{
  "calibration_results": {
    "development_sample_count": 225,
    "selected_operating_point_id": "fixture-op-v1",
    "uncertainty_method": "WILSON_SCORE",
    "validation_sample_count": 75
  },
  "created_at": "2026-07-28T11:00:00+00:00",
  "development_dataset_sha256": "cccccccccccccccccccccccccccccccccccccccccccccccccccccccccccccccc",
  "feature_contract_version": "1.1.0",
  "gate_policy_artifact_sha256": "9f31e4579350e2f74dc1ec01632d8cd49802b5e7ee6f00931b71d430e5d9f4f2",
  "gate_policy_version": "1.0.0",
  "integrity": {
    "self_sha256": "e8b3b871dda5a17d2f449ed894b23a4b1d5614180fbc59035f92171560926a76"
  },
  "metric_target": {
    "auto_approval_precision_target": 0.95,
    "confidence_level": 0.95
  },
  "model": {
    "feature_names": [
      "C_mean",
      "C_min",
      "E_authority",
      "E_independence",
      "E_domain",
      "E_concept",
      "E_conventionality",
      "E_coverage"
    ],
    "model_type": "LOGISTIC_REGRESSION",
    "parameters": {
      "coefficients": {
        "C_mean": 1.8,
        "C_min": 0.0,
        "E_authority": 0.0,
        "E_concept": 1.1,
        "E_conventionality": 0.0,
        "E_coverage": 0.0,
        "E_domain": 0.0,
        "E_independence": 0.0
      },
      "intercept": -0.5,
      "link_function": "LOGIT"
    }
  },
  "numerical_tolerance": 1e-12,
  "operating_point": {
    "coverage": 0.42,
    "observed_precision": 0.97,
    "operating_point_id": "fixture-op-v1",
    "precision_lower_bound": 0.95,
    "threshold": 0.84
  },
  "schema_id": "CalibrationArtifactV1",
  "schema_version": "1.1.0",
  "threshold_stability": {
    "decision_flip_rate": 0.06,
    "method": "CLUSTER_BOOTSTRAP",
    "replicate_count": 1000,
    "resampling_unit": "sense_id",
    "threshold_ci_lower": 0.78,
    "threshold_ci_upper": 0.9,
    "threshold_median": 0.84
  },
  "validation_dataset_sha256": "dddddddddddddddddddddddddddddddddddddddddddddddddddddddddddddddd",
  "verification_status": "SEALED"
}
